{
  "schemaVersion": "fenrua.claim-register.v1",
  "lastReviewed": "2026-07-14",
  "sourceReferences": {
    "companyIdentityId": "company-identity",
    "siteEvidenceId": "site-evidence-input",
    "documentRegisterId": "public-document-register"
  },
  "claims": [
    {
      "id": "claim.platform.public-evidence-interface",
      "anchor": "claim-platform-public-evidence-interface",
      "statement": "Fenrua publishes a public technical evidence interface for its stated AI efficiency infrastructure research, software, and related technology-services scope.",
      "subjectId": "capability.public-website",
      "assertionState": "current",
      "assuranceVerb": "published",
      "evidenceClass": "specification",
      "evidenceIds": ["site-evidence-input", "source-public-interface-doctrine"],
      "scope": "Public website positioning and the routes within the stated public interface boundary.",
      "environment": "Public static website source.",
      "assessor": "Fenrua public source record",
      "independence": "same-author",
      "validFrom": "2026-07-14",
      "expiresAt": null,
      "supersedes": [],
      "supersededBy": null,
      "limitations": ["The statement does not attest to protected systems, live APIs, or future platform capability."],
      "publicRoutes": ["/", "/legal"]
    },
    {
      "id": "claim.platform.protocol-label",
      "anchor": "claim-platform-protocol-label",
      "statement": "Fenrua Protocol is the current public platform label, while Fenrua Labs Pty Ltd is the registered operator named on public pages.",
      "subjectId": "capability.public-website",
      "assertionState": "current",
      "assuranceVerb": "published",
      "evidenceClass": "specification",
      "evidenceIds": ["source-public-homepage", "site-evidence-input"],
      "scope": "Current public naming and operator attribution.",
      "environment": "Public static website source.",
      "assessor": "Fenrua public source record",
      "independence": "same-author",
      "validFrom": "2026-07-14",
      "expiresAt": null,
      "supersedes": [],
      "supersededBy": null,
      "limitations": ["The label does not establish availability or maturity of a capability beyond its individual record."],
      "publicRoutes": ["/", "/legal"]
    },
    {
      "id": "claim.release.static-artifact-binding",
      "anchor": "claim-release-static-artifact-binding",
      "statement": "When generated for a release, the public release manifest binds only its listed static artifacts to the exact release checkout and stated validation scope.",
      "subjectId": "capability.release-evidence",
      "assertionState": "current",
      "assuranceVerb": "published",
      "evidenceClass": "release",
      "evidenceIds": ["source-release-pipeline"],
      "scope": "Release-manifest contract and static public artifact boundary.",
      "environment": "Release build and canonical public static output.",
      "assessor": "Fenrua release procedure",
      "independence": "same-author",
      "validFrom": "2026-07-14",
      "expiresAt": null,
      "supersedes": [],
      "supersededBy": null,
      "limitations": ["The binding is not runtime attestation and does not cover live cards, APIs, or protected infrastructure."],
      "publicRoutes": ["/audit"]
    },
    {
      "id": "claim.evidence.point-in-time-boundary",
      "anchor": "claim-evidence-point-in-time-boundary",
      "statement": "Public evidence records are point-in-time artifacts with stated revision, maturity, validation method, evidence, and limitations.",
      "subjectId": "capability.evidence-registry",
      "assertionState": "current",
      "assuranceVerb": "published",
      "evidenceClass": "specification",
      "evidenceIds": ["site-evidence-input", "source-public-interface-doctrine"],
      "scope": "Public evidence registry and release-audit record descriptions.",
      "environment": "Public static website source.",
      "assessor": "Fenrua public source record",
      "independence": "same-author",
      "validFrom": "2026-07-13",
      "expiresAt": null,
      "supersedes": [],
      "supersededBy": null,
      "limitations": ["Publication is not universal certification, a future-state assertion, or proof that an underlying campaign has been rerun."],
      "publicRoutes": ["/evidence", "/audit"]
    },
    {
      "id": "claim.toolchain.version-capture",
      "anchor": "claim-toolchain-version-capture",
      "statement": "The public toolchain registry labels a version as verified only within the inspected evidence environment captured by that registry.",
      "subjectId": "capability.toolchain-registry",
      "assertionState": "current",
      "assuranceVerb": "verified",
      "evidenceClass": "build",
      "evidenceIds": ["source-toolchain-registry"],
      "scope": "Published tool version-capture labels and their source-record boundary.",
      "environment": "Captured local evidence environment described by the registry.",
      "assessor": "Fenrua toolchain registry",
      "independence": "same-author",
      "validFrom": "2026-07-13",
      "expiresAt": null,
      "supersedes": [],
      "supersededBy": null,
      "limitations": ["Version verification does not prove current installation, production use, security, or availability."],
      "publicRoutes": ["/toolchain", "/research/toolchain-evidence-lock"]
    },
    {
      "id": "claim.verifier.local-boundary",
      "anchor": "claim-verifier-local-boundary",
      "statement": "The public verifier surface is a local fixture and result-code foundation; no live server-side verifier is claimed.",
      "subjectId": "capability.local-verifier",
      "assertionState": "current",
      "assuranceVerb": "published",
      "evidenceClass": "specification",
      "evidenceIds": ["source-verification-result-spec", "source-capability-maturity-register"],
      "scope": "Public verification result model, examples, and local-check boundary.",
      "environment": "Repository-local verification fixtures.",
      "assessor": "Fenrua public source record",
      "independence": "same-author",
      "validFrom": "2026-07-12",
      "expiresAt": null,
      "supersedes": [],
      "supersededBy": null,
      "limitations": ["A local fixture does not validate artifacts that were not supplied or establish runtime conformity."],
      "publicRoutes": ["/verify", "/developers"]
    },
    {
      "id": "claim.observation.signed-read-only",
      "anchor": "claim-observation-signed-read-only",
      "statement": "The public observation contract permits only bounded, read-only signed observations with declared failure semantics and verification metadata.",
      "subjectId": "capability.observation-978",
      "assertionState": "current",
      "assuranceVerb": "signed",
      "evidenceClass": "observation",
      "evidenceIds": ["source-observation-gateway"],
      "scope": "Public observation contract and its bounded field set.",
      "environment": "Public observation gateway boundary.",
      "assessor": "Fenrua public observation specification",
      "independence": "same-author",
      "validFrom": "2026-07-14",
      "expiresAt": null,
      "supersedes": [],
      "supersededBy": null,
      "limitations": ["A signed observation does not establish contract safety, bytecode identity, reserve state, finality, or deployment correctness."],
      "publicRoutes": ["/", "/status", "/research/read-only-chain-observation"]
    },
    {
      "id": "claim.observation.observed-block-label",
      "anchor": "claim-observation-observed-block-label",
      "statement": "When a public observation is emitted under its declared contract, its block field is presented as an observed block rather than a deployment or safety assertion.",
      "subjectId": "capability.observation-978",
      "assertionState": "current",
      "assuranceVerb": "observed",
      "evidenceClass": "observation",
      "evidenceIds": ["source-observation-gateway"],
      "scope": "Public observation-field naming and boundary.",
      "environment": "Public observation gateway boundary.",
      "assessor": "Fenrua public observation specification",
      "independence": "same-author",
      "validFrom": "2026-07-14",
      "expiresAt": null,
      "supersedes": [],
      "supersededBy": null,
      "limitations": ["No current observation is asserted when the source is unavailable, stale, or awaiting independent evidence."],
      "publicRoutes": ["/", "/status"]
    },
    {
      "id": "claim.observation.n521-awaiting",
      "anchor": "claim-observation-n521-awaiting",
      "statement": "Chain N521 has no liveness claim until an independent gateway and public verification key are configured; the public boundary uses an awaiting state instead of fabricated data.",
      "subjectId": "capability.observation-n521",
      "assertionState": "current",
      "assuranceVerb": "published",
      "evidenceClass": "specification",
      "evidenceIds": ["source-capability-maturity-register", "source-observation-gateway"],
      "scope": "Chain N521 public observation availability boundary.",
      "environment": "Public observation gateway boundary.",
      "assessor": "Fenrua public source record",
      "independence": "same-author",
      "validFrom": "2026-07-14",
      "expiresAt": null,
      "supersedes": [],
      "supersededBy": null,
      "limitations": ["This statement does not assert that an independent publisher, gateway, key, or current chain observation is configured."],
      "publicRoutes": ["/", "/status", "/research/read-only-chain-observation"]
    },
    {
      "id": "claim.kernel.non-production-boundary",
      "anchor": "claim-kernel-non-production-boundary",
      "statement": "The public security-kernel specification states responsibilities and fail-closed conditions without claiming that the specification alone certifies production safety.",